{
  "schema_version": "js-m2-coupon-experiment-1",
  "experiment": {"id": "M2-AD5-EXAMPLE-NOT-REGISTERED", "registration_status": "template", "owner": "Jared"},
  "printer": {"model": "AD5M", "serial": "SYNTHETIC-EXAMPLE-NOT-A-PRINTER", "firmware": "REPLACE", "startup_assumptions": ["REPLACE_WITH_VERIFIED_STARTUP_STATE"], "identity_status": "template", "machine_fingerprint_sha256": "0000000000000000000000000000000000000000000000000000000000000000", "synthetic": true},
  "process": {"material_family": "PLA", "material_lot": "SYNTHETIC-EXAMPLE", "nozzle_id": "REPLACE", "nozzle_diameter_mm": 0.4, "layer_height_mm": 0.2, "line_width_mm": 0.45, "print_temperature_c": 215, "bed_temperature_c": 60, "fan_percent": 0, "ambient_temperature_c": 25},
  "model": {"model_id": "synthetic-example", "model_hash": "synthetic-example", "calibration_hash": "synthetic-example"},
  "variants": {"baseline": {"identity": "source-order", "description": "unchanged source order"}, "proposed": {"identity": "m2-proposal", "description": "actual scheduler proposal"}},
  "measurement_protocol": {"required": ["contact-age thermography", "destructive bond proxy", "visible quality", "bridge/support effects", "print time", "exclusion reason"]},
  "acceptance": {"minimum_bond_proxy_improvement_percent": 10, "visible_quality_noninferiority_delta": 0, "print_time_max_increase_percent": 5, "minimum_included_confirmatory_pairs": 3},
  "abort_exclusion": {"criteria": ["thermal runaway", "failed adhesion", "unrecorded intervention", "instrument calibration failure"]},
  "evidence": {"files": ["raw-observations.csv", "normalized-measurements.json", "instrument calibration", "photos", "verifier reports", "operator checklist"]},
  "sample_plan": {"calibration_coupon_ids": ["CAL-1", "CAL-2", "CAL-3"], "confirmatory_coupon_ids": ["CONF-1", "CONF-2", "CONF-3"]},
  "randomization": {"unit": "coupon_pair", "seed": 20260919}
}
